title,url,desc,content
"
            Jurus BSI Genjot Pemberdayaan Ekonomi Lokal Berbasis Syariah
         ",https://finance.detik.com/moneter/d-7594311/jurus-bsi-genjot-pemberdayaan-ekonomi-lokal-berbasis-syariah,"
            Direktur Compliance & Human Capital BSI Tribuana Tunggadewi mengatakan saat ini BSI semakin fokus untuk pemberdayaan UMKM.         ","PT Bank Syariah Indonesia Tbk (BSI) berkomitmen memperkuat kemandirian ekonomi lokal dan meningkatkan kesejahteraan masyarakat melalui peresmian Sentra UMKM BSI di Kampung Candikuning, Bedugul, Bali 18 Oktober 2024.
Direktur Compliance & Human Capital BSI Tribuana Tunggadewi mengatakan saat ini BSI semakin fokus untuk pemberdayaan UMKM. Ia menekankan pentingnya peran UMKM dalam menggerakkan ekonomi daerah.
Sentra UMKM Bedugul menjadi model pemberdayaan berbasis ekonomi syariah dengan tiga bidang usaha utama yakni pertanian holtikultura, minimarket yang menjual produk-produk lokal, serta gedung serbaguna untuk kegiatan ekonomi dan sosial seperti pertemuan dan acara pernikahan.
""Kami memilih Bali karena sebagai destinasi pariwisata internasional, Bali memiliki potensi besar untuk mendukung pertumbuhan UMKM yang berkelanjutan. Dengan adanya Sentra UMKM di sini, kami berharap dapat mendorong pemerataan ekonomi dan meningkatkan kesejahteraan masyarakat Bali,"" jelas Dewi di Bedugul, Bali Jumat (18/10/2024).
Sentra UMKM BSI di Bedugul, Kampung Candikuning menjadi salah contoh sentra UMKM BSI yang memilki prioritas sektor pariwisata dan menjadi pertama kali diresmikan oleh BSI. Kampung Candikuning berlokasi di antara 3 obyek wisata popular yaitu Pura Ulun Danu Bratan, Danau Beratan dan Kebun Raya Eka Karya Bali. Di Sentra UMKM BSI Bedugul jumlah penerima manfaat direncanakan sebanyak 50 KK dan 160 jiwa.
""BSI semakin fokus pada pemberdayaan UMKM. Hal tersebut menjadi salah satu upaya strategis perseroan untuk mendorong dan memperkuat peran ekonomi syariah sebagai katalis utama penopang pertumbuhan ekonomi Indonesia ke depan,"" ujar Dewi.
Dewi mengatakan, sebagai bank syariah terbesar di Indonesia, BSI memiliki tanggung jawab dalam pemberdayaan ekonomi umat melalui dana ZISWAF, khususnya zakat. Oleh karena itu, BSI berkolaborasi dengan BSI Maslahat dan BAZNAS RI membangun Sentra UMKM untuk memberikan kesempatan yang luas bagi masyarakat untuk berusaha dan peningkatan kesejahteraan di seluruh wilayah Indonesia.
""Sentra UMKM ini menjadi salah satu implementasi dari program zakat kami, yang diharapkan dapat mengangkat mustahik dari yang semula tidak bankable menjadi bankable,"" ujar Dewi.
Dewi juga menjelaskan bahwa terdapat perbedaan antara Sentra UMKM BSI dengan BSI UMKM Center yang saat ini ada di empat kota besar Indonesia.
""Kelas usaha di Sentra UMKM berbeda dengan UMKM Center. Di UMKM Center, kami mendukung usaha kecil, menengah, dan mikro, sedangkan di Sentra UMKM fokus kami adalah pada usaha mikro dan ultra mikro,"" jelas Dewi.
Ia juga menambahkan bahwa penerima manfaat UMKM Center terbuka untuk umum dan didanai melalui pembiayaan sedangkan Sentra UMKM ditujukan khusus untuk mustahik, dengan pendanaan berasal dari zakat, dengan fokus untuk membantu UMKM menjadi legal, feasible, dan bankable.
Hingga Agustus 2024, BSI telah membangun 35 Sentra UMKM yang tersebar di seluruh Indonesia, termasuk di Sumatera, Jawa, Bali, Kalimantan, dan Sulawesi. Program ini telah memberikan manfaat kepada 3.717 jiwa dengan penyaluran dana zakat sebesar Rp 17,4 miliar, di mana Rp 1,5 miliar di antaranya dialokasikan khusus untuk Sentra UMKM Bedugul.
Dewi menegaskan bahwa pembukaan Sentra UMKM BSI ini juga merupakan salah satu komitmen BSI untuk meningkatkan pariwisata di Bali, khususnya di kawasan Bali Tengah agar terjadi pemerataan ekonomi bagi seluruh masyarakat Bali.
""Semoga kehadiran BSI di Bedugul mampu membawa nilai tambah, kemaslahatan, dan meningkatkan perekonomian masyarakat, sekaligus meningkatkan literasi dan inklusi keuangan syariah di Bali,"" jelas Dewi."
